{
  "schema_version": "1.0.0",
  "report_kind": "synthetic_test",
  "context": {
    "mode": "local_lab",
    "collection_id": "10000000-0000-4000-8000-000000000007",
    "case_id": "10000000-0000-4000-8000-000000000005",
    "operator_id": "10000000-0000-4000-8000-000000000003",
    "endpoint_id": "10000000-0000-4000-8000-000000000002",
    "designation_id": "10000000-0000-4000-8000-000000000001",
    "authorisation_id": "10000000-0000-4000-8000-000000000004",
    "policy_id": "10000000-0000-4000-8000-000000000006"
  },
  "started_at": {
    "value": "2020-01-01T00:00:00Z",
    "basis": "local_clock",
    "uncertainty_ms": null,
    "clock_uncertain": false
  },
  "finished_at": {
    "value": "2020-01-01T00:00:00Z",
    "basis": "local_clock",
    "uncertainty_ms": null,
    "clock_uncertain": false
  },
  "endpoint": {
    "schema_version": "1.0.0",
    "endpoint_id": "10000000-0000-4000-8000-000000000002",
    "os_family": "linux",
    "architecture": {
      "state": "available",
      "value": "x86_64"
    },
    "distribution": {
      "id": {
        "state": "available",
        "value": "synthetic"
      },
      "version": {
        "state": "available",
        "value": "0"
      }
    },
    "kernel_release": {
      "state": "available",
      "value": "synthetic-kernel"
    },
    "abi": {
      "state": "available",
      "value": "gnu"
    },
    "namespace_scope": "current",
    "observed_at": {
      "value": "2020-01-01T00:00:00Z",
      "basis": "local_clock",
      "uncertainty_ms": null,
      "clock_uncertain": false
    },
    "facilities": [
      {
        "source_id": "10000000-0000-4000-8000-000000000008",
        "state": "supported",
        "reason": null
      }
    ]
  },
  "inputs": {
    "designation": {
      "id": "10000000-0000-4000-8000-000000000001",
      "schema_version": "1.0.0",
      "sha256": "bf1982f55afdcdd7ce743b76d0a379bfa6f4b43378c71cfeb34cc01628265e42"
    },
    "authorisation": {
      "id": "10000000-0000-4000-8000-000000000004",
      "schema_version": "1.0.0",
      "sha256": "72f14f5b3469116b7a57b011d61c73a735774637bb4732132a769fdafa64d762"
    },
    "policy": {
      "id": "10000000-0000-4000-8000-000000000006",
      "schema_version": "1.0.0",
      "sha256": "c1cbb104b235ffd1aa9985a8b067a513060472d76e8577b00e067623583f91ba"
    },
    "request": {
      "id": "10000000-0000-4000-8000-000000000007",
      "schema_version": "1.0.0",
      "sha256": "055f19ed8522fc6d917e760170c94273c8e279c7d1467874088307c0bf921cd4"
    },
    "indicators": null
  },
  "collectors": [
    {
      "collector": "system",
      "status": "complete",
      "coverage": [
        {
          "source_id": "10000000-0000-4000-8000-000000000008",
          "state": "supported",
          "reason": null
        }
      ],
      "accepted_records": 1,
      "omitted_records": 0,
      "omitted_reason": null,
      "errors": 0,
      "stop_reason": null
    }
  ],
  "records": [
    {
      "schema_version": "2.0.0",
      "record_id": "130957f1-1f1a-81cf-9193-e18ef0f0a3f8",
      "context": {
        "mode": "local_lab",
        "collection_id": "10000000-0000-4000-8000-000000000007",
        "case_id": "10000000-0000-4000-8000-000000000005",
        "operator_id": "10000000-0000-4000-8000-000000000003",
        "endpoint_id": "10000000-0000-4000-8000-000000000002",
        "designation_id": "10000000-0000-4000-8000-000000000001",
        "authorisation_id": "10000000-0000-4000-8000-000000000004",
        "policy_id": "10000000-0000-4000-8000-000000000006"
      },
      "collected_at": {
        "value": "2020-01-01T00:00:00Z",
        "basis": "local_clock",
        "uncertainty_ms": null,
        "clock_uncertain": false
      },
      "collector": {
        "name": "system",
        "version": "1.0.0",
        "adapter": "linux.kernel-profile-v1"
      },
      "category": "system",
      "severity": "informational",
      "record_type": "profile",
      "sequence": 0,
      "provenance": {
        "source_id": "10000000-0000-4000-8000-000000000008",
        "source_kind": "kernel_profile",
        "observed_start": {
          "value": "2020-01-01T00:00:00Z",
          "basis": "local_clock",
          "uncertainty_ms": null,
          "clock_uncertain": false
        },
        "observed_end": {
          "value": "2020-01-01T00:00:00Z",
          "basis": "local_clock",
          "uncertainty_ms": null,
          "clock_uncertain": false
        },
        "policy_sha256": "c1cbb104b235ffd1aa9985a8b067a513060472d76e8577b00e067623583f91ba",
        "authorisation_sha256": "72f14f5b3469116b7a57b011d61c73a735774637bb4732132a769fdafa64d762",
        "request_sha256": "055f19ed8522fc6d917e760170c94273c8e279c7d1467874088307c0bf921cd4",
        "source_scope": {
          "kind": "facility",
          "source_id": "10000000-0000-4000-8000-000000000008",
          "namespace": "current"
        },
        "indicator_set_sha256": null,
        "rules_version": null
      },
      "payload": {
        "os_family": "linux",
        "kernel_release": {
          "state": "available",
          "value": "synthetic-kernel"
        },
        "kernel_version": {
          "state": "available",
          "value": "synthetic"
        },
        "architecture": {
          "state": "available",
          "value": "x86_64"
        },
        "hostname": {
          "state": "available",
          "value": "synthetic.invalid"
        },
        "distribution_id": {
          "state": "available",
          "value": "synthetic"
        },
        "distribution_version": {
          "state": "available",
          "value": "0"
        },
        "boot_id": {
          "state": "available",
          "value": "10000000-0000-4000-8000-000000000011"
        }
      },
      "details": {
        "linux": {}
      },
      "content_sha256": "c7d0c673c316b8790276b92ecedd96ef95e1573bdc0f4935fcf6e574560371f2"
    }
  ],
  "errors": [],
  "summary": {
    "status": "complete",
    "stop_reason": null,
    "accepted_records": 1,
    "errors": 0,
    "omitted_known": 0,
    "omitted_unknown": false,
    "source_bytes": 9,
    "report_bytes": 5607,
    "work_used": {
      "entries": 1,
      "indicator_comparisons": 0,
      "errors": 0,
      "source_bytes": 9,
      "staging_bytes": 0,
      "retained_bytes": 0
    },
    "worker_cleanup": "complete"
  },
  "manifest": {
    "schema_version": "2.0.0",
    "manifest_id": "2e239f93-3cb7-8897-bf08-302c44240cc2",
    "context": {
      "mode": "local_lab",
      "collection_id": "10000000-0000-4000-8000-000000000007",
      "case_id": "10000000-0000-4000-8000-000000000005",
      "operator_id": "10000000-0000-4000-8000-000000000003",
      "endpoint_id": "10000000-0000-4000-8000-000000000002",
      "designation_id": "10000000-0000-4000-8000-000000000001",
      "authorisation_id": "10000000-0000-4000-8000-000000000004",
      "policy_id": "10000000-0000-4000-8000-000000000006"
    },
    "created_at": {
      "value": "2020-01-01T00:00:00Z",
      "basis": "local_clock",
      "uncertainty_ms": null,
      "clock_uncertain": false
    },
    "entries": [
      {
        "record_id": "130957f1-1f1a-81cf-9193-e18ef0f0a3f8",
        "sequence": 0,
        "byte_length": 2087,
        "sha256": "5177255597dfeef1e6e267a19d84aad41c73909f75648835820a5a451eee44ce"
      }
    ],
    "content_sha256": "9279fae9765aee991029acaf11bcc68f7871e54abbdf207b8f7c28eccaa92490"
  },
  "content_sha256": "5af9b1948ab0e9a8df1e0725fb6cb3f63587a09658b62a4e601cefa234073589"
}
